Name,Term,ES,NES,NOM p-val,FDR q-val,FWER p-val,Tag %,Gene %,Lead_genes
prerank,Activation Of GTPase Activity (GO:0090630),0.6191856657467069,1.187053783013327,0.22875816993464052,1.0,1.0,12/86,2.59%,Ntrk3;Tiam1;Ralgapa2;Rasgrf1;Agap1;Ntf3;Sipa1l1;Sipa1l3;Sipa1l2;Tbc1d8b;Sgsm2;Pip5k1a
prerank,Negative Regulation Of miRNA Metabolic Process (GO:2000629),0.7445131555333958,1.186992471086915,0.3089005235602094,1.0,1.0,2/19,1.66%,Nfib;Ncor1
prerank,miRNA Metabolic Process (GO:0010586),-0.7399622403254771,-1.1862803103292854,0.3065015479876161,1.0,1.0,3/15,5.56%,Lin28b;Tut7;Tent4b
prerank,Peptidyl-Lysine Methylation (GO:0018022),0.7349776226611081,1.185812587870904,0.2962962962962963,1.0,1.0,5/23,10.10%,Kmt5a;Ehmt1;Smyd2;Setd7;Setd2
prerank,Positive Regulation Of Establishment Of Protein Localization To Mitochondrion (GO:1903749),-0.6978917031891776,-1.1857943462801825,0.25806451612903225,1.0,1.0,6/31,11.86%,Sh3glb1;Srebf2;Mapk8;Micall2;Rac2;Usp36
prerank,Positive Regulation Of Cell Migration Involved In Sprouting Angiogenesis (GO:0090050),-0.7455337504146423,-1.1856320407646432,0.284789644012945,1.0,1.0,6/16,12.95%,Jcad;Rhoj;Vegfa;Pik3c2a;Cib1;Foxc2
prerank,Regulation Of miRNA Transcription (GO:1902893),0.6532782659912438,1.185447834672645,0.2562358276643991,1.0,1.0,10/55,4.89%,Nfib;Mrtfb;Tead1;Mrtfa;Ncor1;Smad3;Jun;Tgfb2;Pou2f1;Smarca4
prerank,Muscle Organ Development (GO:0007517),-0.6544860943286301,-1.185167105093058,0.23117338003502627,1.0,1.0,8/52,4.86%,Sgcd;Dmd;Utrn;Sox6;Igf1;Fhl1;Neb;Chodl
prerank,Regulation Of Neurotransmitter Secretion (GO:0046928),0.6941871891279998,1.1849347636198095,0.2827586206896552,1.0,1.0,6/38,2.92%,Mctp1;Camk2a;Rims1;Cplx2;Mef2c;Sncaip
prerank,Aerobic Respiration (GO:0009060),0.6587459203597619,1.1838912653914224,0.2471655328798186,1.0,1.0,1/57,0.87%,Me3
prerank,Membrane Protein Proteolysis (GO:0033619),-0.7085738579720173,-1.183637136709051,0.2680921052631579,1.0,1.0,7/31,8.61%,Adam19;Bace2;Ret;Prkcq;Ctsh;Tgfb1;Adam17
prerank,Negative Regulation Of miRNA Transcription (GO:1902894),0.7457927279111134,1.1834340451624679,0.3148148148148148,1.0,1.0,2/18,1.66%,Nfib;Ncor1
prerank,Regulation Of Axonogenesis (GO:0050770),0.6848014602505738,1.1827153096705882,0.2658536585365854,1.0,1.0,8/41,2.71%,Plxna4;Tiam1;Epha4;Robo2;Chn1;Sipa1l1;Pak3;Cdh2
prerank,Positive Regulation Of Biomineral Tissue Development (GO:0070169),-0.6880455392495071,-1.1827132402925205,0.24285714285714285,1.0,1.0,5/40,2.59%,Nell1;Slc8a1;Ptn;Bmpr1b;P2rx7
prerank,Artery Morphogenesis (GO:0048844),-0.7031722582982418,-1.1820357168264333,0.26936619718309857,1.0,1.0,8/29,9.06%,Nell1;Nf1;Smad7;Tgfbr2;Lrp1;Vegfa;Hpgd;Pdgfrb
prerank,Golgi To Endosome Transport (GO:0006895),0.7542097094408662,1.1817774428557555,0.32299741602067183,1.0,1.0,3/15,3.99%,Vps13c;Vps13a;Sort1
prerank,Regulation Of Actin Filament Bundle Assembly (GO:0032231),-0.7088504404194638,-1.1816061176632469,0.2630718954248366,1.0,1.0,6/26,9.41%,Mtss1;Asap3;Slc9a1;Plek;Alms1;Limk1
prerank,Positive Regulation Of Cell Projection Organization (GO:0031346),0.5971166394154428,1.1812845576553688,0.21797752808988763,1.0,1.0,19/115,2.02%,Ntrk3;Plxna4;Il1rapl1;Tiam1;Lrrc7;Prkd1;Camk2b;Ptk2b;Robo2;Carmil1;Rapgef2;Nlgn1;Ror1;Magi2;Arsb;Rit2;Nptn;Bdnf;Ndrg4
prerank,Cellular Response To Estrogen Stimulus (GO:0071391),-0.7484112569222863,-1.1806977388280697,0.2589703588143526,1.0,1.0,5/15,7.31%,Rara;Esr1;Esr2;Crhbp;Sox9
prerank,Positive Regulation Of Cation Channel Activity (GO:2001259),0.6909126453587597,1.1806428681240027,0.27586206896551724,1.0,1.0,5/37,2.66%,Ppp3ca;Ank3;Kcnip2;Ank2;Ppp3r1
prerank,Regulation Of Telomere Maintenance Via Telomere Lengthening (GO:1904356),0.7681347811905482,1.1805904575831796,0.34096692111959287,1.0,1.0,4/15,8.15%,Tnks;Ercc4;Parp1;Dhx36
prerank,Negative Regulation Of Viral Process (GO:0048525),0.665805324305131,1.1804132614468188,0.24685138539042822,1.0,1.0,1/50,0.01%,Prox1
prerank,Positive Regulation Of Cell Motility (GO:2000147),0.5508788839697341,1.1799713287243907,0.15894039735099338,1.0,1.0,17/203,3.28%,Ntrk3;Sema5a;Ppp3ca;Tiam1;Epha4;Ptk2b;Carmil1;Cemip;Ntf3;Sema6d;Cntn1;Ptk2;Tgfbr1;Acvr1;Cdh13;Sema5b;Sdcbp
prerank,Positive Regulation Of Actin Filament Polymerization (GO:0030838),0.6968828780615283,1.1799652893445227,0.2843601895734597,1.0,1.0,6/35,1.07%,Prkce;Ptk2b;Tenm1;Carmil1;Baiap2;Nckap1
prerank,Homotypic Cell-Cell Adhesion (GO:0034109),-0.6807306990474052,-1.1795112733150732,0.27474402730375425,1.0,1.0,15/41,11.68%,Tyro3;Vcl;Plpp3;Gnas;Cxadr;Dsc2;Pdgfra;Megf10;Megf11;Csrp1;Plek;Flna;Clic1;Tjp2;P2ry12
prerank,Regulation Of Transcription Involved In G1/S Transition Of Mitotic Cell Cycle (GO:0000083),0.7373355122801208,1.1794649253696006,0.3155216284987277,1.0,1.0,2/18,1.94%,Cdk14;Cdk17
prerank,Focal Adhesion Assembly (GO:0048041),0.7327086869748098,1.1791972409484213,0.2982005141388175,1.0,1.0,5/21,3.92%,Sorbs1;Ptprk;Pip5k1a;Arhgef7;Actn2
prerank,Regulation Of Telomere Maintenance Via Telomerase (GO:0032210),0.6713522931213378,1.1791020958544496,0.2708333333333333,1.0,1.0,11/50,6.64%,Tenm1;Mapk1;Map3k4;Hmbox1;Tnks;Pkib;Hnrnpu;Mapk3;Src;Cct5;Ctnnb1
prerank,Protein Localization To Chromatin (GO:0071168),-0.6884594607449862,-1.1790978774734404,0.2685025817555938,1.0,1.0,5/30,10.10%,Lef1;Esr1;Zmynd8;Macroh2a2;Fam47e
prerank,Regulation Of Epidermal Cell Differentiation (GO:0045604),-0.7334787291188963,-1.1790390216502904,0.2850467289719626,1.0,1.0,4/16,10.39%,Mafg;Klf7;Zfp36l1;Sfrp4
prerank,Positive Regulation Of Interleukin-1 Beta Production (GO:0032731),-0.6878689696155108,-1.179004907996356,0.26194690265486725,1.0,1.0,12/42,14.63%,Egr1;Lcp1;P2rx7;App;Jak2;Casp1;Tyrobp;Casp8;Wnt5a;Trim16;Tlr6;Nlrp3
prerank,Negative Regulation Of Telomere Maintenance Via Telomerase (GO:0032211),0.7466416846299269,1.1789645286386359,0.3281653746770026,1.0,1.0,3/18,5.45%,Tenm1;Hnrnpu;Src
prerank,Negative Regulation Of GTPase Activity (GO:0034260),-0.7181279435757698,-1.1789316674709995,0.28407224958949095,1.0,1.0,6/20,6.41%,Cpeb2;Lrrk2;Dab2ip;Wnk1;Sh3bp4;Plxnb3
prerank,Regulation Of Calcium-Mediated Signaling (GO:0050848),0.6975411623418081,1.1788912728821277,0.2971576227390181,1.0,1.0,7/28,3.86%,Slc8a2;Rit2;Slc24a4;Neurod2;Cdh13;Plcg2;Itpr1
prerank,Regulation Of JUN Kinase Activity (GO:0043506),-0.6677032667271602,-1.1783030504364174,0.252991452991453,1.0,1.0,8/41,6.55%,Sash1;Dusp10;Tnfrsf11a;Pak1;Map4k2;Ppef2;Dab2ip;Dusp16
prerank,Regulation Of Smooth Muscle Contraction (GO:0006940),-0.7149925323262367,-1.1774566451782071,0.2897822445561139,1.0,1.0,2/20,1.00%,Chrm3;Chrm2
prerank,Negative Regulation Of Neuron Differentiation (GO:0045665),-0.7271411083122996,-1.1768547150914834,0.28821656050955413,1.0,1.0,8/22,13.36%,Cntn4;Dlx1;Sox2;Bmp7;Sox9;Six3;Hes5;Hes1
prerank,Negative Regulation Of NIK/NF-kappaB Signaling (GO:1901223),-0.7221883836446032,-1.1767741403637142,0.28733766233766234,1.0,1.0,6/25,7.87%,Ccn3;Bmp7;Myo1c;Cyld;Uaca;Spi1
prerank,Inositol Phosphate Metabolic Process (GO:0043647),0.7224091652388359,1.176523043469415,0.33756345177664976,1.0,1.0,7/22,5.81%,Ippk;Itpka;Itpkb;Inpp4a;Inpp5j;Ip6k2;Inpp4b
prerank,Cardiac Muscle Tissue Morphogenesis (GO:0055008),0.7109205214658838,1.1765115113058984,0.28536585365853656,1.0,1.0,3/27,3.21%,Prox1;Tgfbr3;Pkp2
prerank,Regulation Of G0 To G1 Transition (GO:0070316),0.69383782890516,1.1753306092470723,0.2630272952853598,1.0,1.0,7/31,5.24%,Dpf3;Arid1b;Smarca2;Dpf1;Smarca4;Smarcd2;Bcl7a
prerank,Protein Sumoylation (GO:0016925),-0.6772683911154648,-1.175208382588302,0.2667844522968198,1.0,1.0,4/41,2.69%,Stx1a;Slf1;Trpm4;Hdac4
prerank,Monoatomic Cation Transmembrane Transport (GO:0098655),0.527710665465273,1.175171976895421,0.14065934065934066,1.0,1.0,39/269,3.62%,Trpc6;Trpm3;Grin2a;Cacna1c;Slc4a4;Kcnd2;Grin2b;Slc24a2;Kcnh1;Kcnc3;Cacna1d;Slc8a2;Slc29a4;Scn2a;Kcng2;Kcnk10;Slc39a6;Scn3b;Grin1;Slc39a11;Slc6a15;Slc24a4;Kcnc4;Atp6v1a;Abcc8;Slc30a3;Kcnq3;Kcna4;Kcnk1;Scn9a;Nalcn;Kcng1;Kcng3;Kcna1;Atp2c1;Atp1a1;Slc6a6;Atp1b1;Ano6
prerank,Response To Cytokine (GO:0034097),-0.5971376429029555,-1.1749196313232926,0.2011605415860735,1.0,1.0,29/115,12.20%,Pid1;Bcl2;Lef1;Aff3;Relb;Hdac4;Csf1r;Dpysl3;Tnfrsf11a;Timp2;App;Rel;Jak2;Asah2;Prkca;Col3a1;Ifnlr1;Xaf1;Irak2;Eif2ak2;Aldh1a2;Map4k3;Cxcr4;Cd74;Trim21;Casp8;Ifitm1;Timp3;Cxcl16
prerank,Histone mRNA Metabolic Process (GO:0008334),-0.7120398528986908,-1.1747626650301088,0.2787136294027565,1.0,1.0,3/22,5.56%,Lsm11;Tut7;Tent4b
prerank,Negative Regulation Of Interleukin-1 Production (GO:0032692),-0.7363043026025181,-1.1741179568141993,0.28,1.0,1.0,7/19,10.63%,Igf1;Cx3cr1;Cd33;Ffar4;Tnfaip3;Gas6;Elf4
prerank,Negative Regulation Of Notch Signaling Pathway (GO:0045746),-0.7089954845460286,-1.1741177791004773,0.2904841402337229,1.0,1.0,8/25,16.70%,Wwp2;Mmp14;Dlk1;Arrdc1;Niban2;Tcim;Bend6;Gata2
prerank,Regulation Of Microtubule Cytoskeleton Organization (GO:0070507),-0.6688932296002542,-1.1739470427069187,0.26527050610820246,1.0,1.0,12/40,8.73%,Efna5;Stmn2;Phldb2;Prkaa2;Epha3;Phldb1;Trim36;Stmn3;Stmn1;Cyld;Fam107a;Clasp2
prerank,Negative Regulation Of Type II Interferon Production (GO:0032689),-0.7134982270255159,-1.173164281628167,0.28292682926829266,1.0,1.0,5/20,10.20%,Rara;Laptm5;Havcr2;Vsir;Gas6
prerank,Synapse Organization (GO:0050808),0.5765667645743299,1.172922820588844,0.18004338394793926,1.0,1.0,25/130,3.62%,Cacnb2;Ppfia2;Kirrel3;Ank3;Lrfn5;Dscam;Gpc4;Snca;Nrcam;Grm5;Gpm6a;Slc8a2;Nlgn1;Chrna7;Bdnf;Arhgap39;Pak3;Cdh2;Slitrk2;Slitrk3;Gphn;Ptprd;Nedd4;Lrrc4;Ntng1
prerank,Positive Regulation Of Bone Mineralization (GO:0030501),-0.6926359925504161,-1.1723263293685333,0.2672566371681416,1.0,1.0,5/36,2.59%,Nell1;Slc8a1;Ptn;Bmpr1b;P2rx7
prerank,mRNA Destabilization (GO:0061157),0.6697240500260754,1.1719704444049157,0.2785714285714286,1.0,1.0,18/43,11.76%,Celf1;Rbm24;Tardbp;Ago2;Fto;Pum1;Khsrp;Dis3l2;Gigyf2;Upf1;Dhx36;Cnot1;Rock1;Ythdf2;Ythdf1;Rc3h1;Rock2;Mov10
prerank,Regulation Of Protein Localization To Cell Surface (GO:2000008),0.6956180921668279,1.1719523161326841,0.32857142857142857,1.0,1.0,4/30,3.92%,Nedd4l;Bdnf;Kcnab2;Actn2
prerank,Regulation Of SMAD Protein Signal Transduction (GO:0060390),-0.6999881543664775,-1.1718978943174188,0.2750865051903114,1.0,1.0,11/25,9.29%,Ccn3;Ovol2;Dab2;Wwtr1;Bmp7;Pparg;Jak2;Lrp1;Tgfb1;Tgfb3;Rbpms
prerank,Negative Regulation Of Protein Modification By Small Protein Conjugation Or Removal (GO:1903321),-0.6437715612417062,-1.1717672606255638,0.24444444444444444,1.0,1.0,11/51,12.63%,Prkcg;Sox4;Sh3rf2;Nxn;Ivns1abp;Cav1;Smad7;Tnfaip3;Trim21;Minar1;Pias3
prerank,mRNA Transcription By RNA Polymerase II (GO:0042789),-0.6908716867214028,-1.1717512561571155,0.2883959044368601,1.0,1.0,7/36,13.87%,Thrb;Rara;Pparg;Taf1;S100a10;Taf7;Taf4b
prerank,Regulation Of Amide Metabolic Process (GO:0034248),0.6764165969483669,1.1710339757114145,0.30073349633251834,1.0,1.0,10/41,9.83%,Grm5;Cyfip1;Samd8;Elp2;Elp4;Rbm3;Gcn1;Rock1;Elp1;Eif4e
prerank,Organic Anion Transport (GO:0015711),0.6239583973907267,1.1700214597928669,0.24186046511627907,1.0,1.0,6/75,4.43%,Slc4a4;Slc4a7;Slc4a10;Slc25a25;Slco3a1;Slc25a23
prerank,Regulation Of Plasminogen Activation (GO:0010755),-0.7373149052920254,-1.169797795264052,0.2746710526315789,1.0,1.0,6/16,16.09%,Serpine2;Runx1;Ctsz;Eno1;S100a10;Serpine1
prerank,Regulation Of Cytokine-Mediated Signaling Pathway (GO:0001959),-0.6680668771196157,-1.1678016472716888,0.26537216828478966,1.0,1.0,11/39,11.66%,Vrk2;Ptprc;Cyld;Irak2;Tnfaip3;Cd74;Axl;Gas6;Ptpn1;Casp8;Palm3
prerank,Skeletal System Development (GO:0001501),-0.5807159228882033,-1.1676821316083195,0.2202797202797203,1.0,1.0,29/132,7.60%,Sox5;Xylt1;Ext1;Trps1;Sulf2;Sulf1;Sox6;Bmp3;Igf1;Creb3l2;Npr3;Cd44;Dlx5;Gnas;Akap13;Col27a1;Gja1;Epyc;Mmp14;Col1a2;Bmp7;Col19a1;Fgfr3;Ucma;Wwox;Tead4;Sox9;Adamts4;Atp7a
prerank,Negative Regulation Of Cellular Process (GO:0048523),0.49528906267700973,1.1672490908284354,0.0912863070539419,1.0,1.0,35/483,3.23%,Prox1;Sema5a;Plxna4;Epha4;Dscam;Vps13c;Ptk2b;Spock3;Slit1;Frmd5;Tenm1;Brinp1;Ptprj;Rasa1;St18;Rapgef2;Celf1;Ppp1r13b;Ptprk;Magi2;Map2k1;Bcl6;Gmnc;Adarb1;Smarca2;Smad3;Cdh13;Pds5b;Rps6ka2;Nck2;Anxa6;Dlg3;Cbfa2t3;Btg1;Ski
prerank,Cyclic Nucleotide Biosynthetic Process (GO:0009190),0.7287756172230444,1.1668671150455745,0.3286908077994429,1.0,1.0,3/18,3.71%,Adcy2;Adcy9;Gucy1b1
prerank,Telomere Maintenance (GO:0000723),0.6360490751998995,1.166585819931583,0.26651480637813213,1.0,1.0,9/62,10.91%,Tenm1;Ercc4;Rad50;Parp1;Rpa1;Ston1;Atm;Ino80d;Pten
prerank,Golgi To Plasma Membrane Protein Transport (GO:0043001),0.6927991740726025,1.165625583785789,0.31794871794871793,1.0,1.0,3/28,1.96%,Ank3;Nsf;Sptbn1
prerank,Neural Crest Cell Differentiation (GO:0014033),-0.725348679419384,-1.1643212281806796,0.30864197530864196,1.0,1.0,1/17,0.75%,Nrg1
prerank,"mRNA Splicing, Via Spliceosome (GO:0000398)",0.5404315254922524,1.164223995370363,0.17659574468085107,1.0,1.0,52/201,12.93%,Sfpq;Celf4;Cdc40;Nova2;Fra10ac1;Hnrnpr;Hnrnpu;Srsf9;Gcfc2;Eftud2;Clns1a;Prpf40a;Srsf1;Hnrnpa3;Ddx5;Mtrex;Syncrip;Rbm10;Hnrnpm;Snrnp40;Rsrc1;Sf3b3;Ncbp1;Ythdc1;Dhx15;Zmat2;Lsm7;Hnrnph1;Zcchc8;Hnrnpc;Snrnp70;Prpf31;Tra2b;Rbm22;Sart3;Gemin8;Snrpd1;Rbm41;Rbmx;Pabpc1;Plrg1;Snrpd3;Rbm5;Snrpb;Bud13;Hnrnpk;Rbm4;Cwc22;Ddx46;Prpf3;Dhx9;Srsf7
prerank,"Negative Regulation Of DNA-templated Transcription, Elongation (GO:0032785)",0.7183266523854691,1.1641875398005168,0.34139784946236557,1.0,1.0,6/16,11.72%,Hnrnpu;Recql5;Tcerg1;Parp1;Vhl;Rnf8
prerank,Brain Development (GO:0007420),0.5586911684793024,1.164177696021887,0.2135306553911205,1.0,1.0,20/156,2.90%,Cadm2;Prox1;Grin2a;Nfib;Epha7;Grin2b;Cntn5;Nrcam;Rtn1;Atxn1;Robo2;Dscaml1;Cntn1;Rapgef2;Grin1;Aff2;Ndrg4;Rogdi;Cdh2;Fbxw11
prerank,Dendritic Cell Differentiation (GO:0097028),-0.7140108819467146,-1.163913566981141,0.3090332805071315,1.0,1.0,4/18,6.36%,Camk4;Clu;Tgfbr2;Lyn
prerank,Regulation Of Toll-Like Receptor Signaling Pathway (GO:0034121),-0.7072266905341941,-1.1638047638291393,0.2973856209150327,1.0,1.0,5/18,15.62%,Tyro3;Birc3;Irak3;Tlr3;Gpr108
prerank,Purine Nucleotide Biosynthetic Process (GO:0006164),0.7266244393450818,1.163744126006002,0.34048257372654156,1.0,1.0,9/20,11.39%,Slc4a7;Nmnat2;Nampt;Ppat;Mthfd1;Pfas;Prps2;Prps1;Adsl
prerank,Regulation Of Endothelial Cell Apoptotic Process (GO:2000351),0.6847765024875097,1.1622339923124976,0.291358024691358,1.0,1.0,5/39,3.62%,Sema5a;Tnip2;Itga4;Pdcd4;Ano6
prerank,Modulation Of Excitatory Postsynaptic Potential (GO:0098815),0.705570251205149,1.1619233638198612,0.33495145631067963,1.0,1.0,9/30,1.74%,Grin2a;Tmem108;Grin2b;Rims1;Ptk2b;Slc8a2;Nlgn1;Chrna7;Grin1
prerank,Negative Regulation Of Smooth Muscle Cell Proliferation (GO:0048662),0.6845379973904425,1.159966093585741,0.30900243309002434,1.0,1.0,5/35,3.11%,Prkg1;Igfbp5;Ndrg4;Mef2c;Pdcd4
prerank,"Nuclear-Transcribed mRNA Catabolic Process, Nonsense-Mediated Decay (GO:0000184)",0.6975376482300016,1.1595128185829522,0.3022113022113022,1.0,1.0,11/28,13.89%,Pnrc1;Smg7;Smg1;Ncbp1;Upf1;Gspt1;Skic8;Upf2;Rc3h1;Smg6;Skic3
prerank,Proteoglycan Metabolic Process (GO:0006029),-0.6856337595182844,-1.1595052133235966,0.2881646655231561,1.0,1.0,9/24,5.16%,Chst8;Xylt1;Sulf2;Hs3st4;Sulf1;Igf1;Bmpr1b;Gal3st4;Fam20b
prerank,Negative Regulation Of Lipid Metabolic Process (GO:0045833),-0.7121245373775951,-1.159213663183344,0.3108974358974359,1.0,1.0,6/21,8.56%,Alk;Ccdc3;Ppp2r5a;Apod;Adra2a;Bscl2
prerank,Protein Targeting (GO:0006605),0.5773613137828647,1.1579350618482143,0.21141649048625794,1.0,1.0,14/120,6.18%,Vps13c;Pard3;Nlgn1;Sorl1;Sdcbp;Zdhhc21;Vps37b;Rab3ip;Vps13a;Zdhhc15;Akap6;Aqp11;Cacng3;Vps41
prerank,"Regulation Of mRNA Splicing, Via Spliceosome (GO:0048024)",0.6051044806337021,1.157925825604027,0.24307036247334754,1.0,1.0,14/88,4.93%,Celf2;Rbfox3;Rbfox1;Celf1;Celf4;Sfswap;Rbm24;Celf3;Rbfox2;Nova2;Celf5;Hnrnpu;Rbm39;Srsf9
prerank,Membrane Depolarization During Cardiac Muscle Cell Action Potential (GO:0086012),0.7423899371925767,1.1578054400095898,0.36828644501278773,1.0,1.0,5/16,1.73%,Cacna1c;Cacnb2;Cacna2d1;Cacna1d;Scn3b
prerank,"RNA Splicing, Via Transesterification Reactions With Bulged Adenosine As Nucleophile (GO:0000377)",0.5446778536779289,1.1572095633008017,0.1903765690376569,1.0,1.0,46/170,12.50%,Cdc40;Nova2;Fra10ac1;Hnrnpr;Hnrnpu;Srsf9;Gcfc2;Eftud2;Prpf40a;Srsf1;Hnrnpa3;Ddx5;Mtrex;Syncrip;Rbm10;Hnrnpm;Snrnp40;Rsrc1;Sf3b3;Ncbp1;Ythdc1;Dhx15;Zmat2;Lsm7;Hnrnph1;Zcchc8;Hnrnpc;Snrnp70;Prpf31;Tra2b;Rbm22;Sart3;Snrpd1;Rbm41;Rbmx;Pabpc1;Plrg1;Snrpd3;Rbm5;Snrpb;Bud13;Hnrnpk;Rbm4;Cwc22;Ddx46;Prpf3
prerank,mRNA Transcription (GO:0009299),-0.6704442268967369,-1.1553966849500448,0.3105175292153589,1.0,1.0,7/39,13.87%,Thrb;Rara;Pparg;Taf1;S100a10;Taf7;Taf4b
prerank,Synapse Assembly (GO:0007416),0.6269127018094602,1.155238921478413,0.27765726681127983,1.0,1.0,14/68,3.58%,Gabrb3;Kirrel3;Gabra2;Dscam;Gabrb2;Nrcam;Gabrg2;Gpm6a;Nlgn1;Bdnf;Srgap3;Cdh2;Ptprd;Lrrc4
prerank,Glutamine Family Amino Acid Metabolic Process (GO:0009064),-0.7014277235990383,-1.1551485324224877,0.29692832764505117,1.0,1.0,6/27,10.71%,Ddah1;Mthfs;Art4;Slc38a1;Glud1;Dglucy
prerank,Regulation Of Developmental Growth (GO:0048638),0.7046468639162762,1.155018495280198,0.33762886597938147,1.0,1.0,5/29,1.14%,Mycbp2;Olfm1;Nrcam;Plcb1;Mbd5
prerank,Positive Regulation Of Peptidyl-Lysine Acetylation (GO:2000758),-0.7068246347257319,-1.1544954675558448,0.3257328990228013,1.0,1.0,5/17,9.21%,Dip2a;Prkaa2;Sox4;Ppargc1a;Dip2b
prerank,Interferon-Mediated Signaling Pathway (GO:0140888),-0.6809146996948545,-1.1540025456988687,0.31551724137931036,1.0,1.0,9/29,14.08%,Hdac4;Hck;Traf3;Jak2;Ifnlr1;Ifi27;Ifitm1;Ifitm3;Oas2
prerank,Macromolecule Biosynthetic Process (GO:0009059),-0.5625152861210473,-1.1538569348294443,0.21296296296296297,1.0,1.0,5/174,5.09%,Ext1;Rrbp1;Zar1l;Apoe;Gal3st4
prerank,Maintenance Of Blood-Brain Barrier (GO:0035633),-0.6880607458128818,-1.1536184436451749,0.30670926517571884,1.0,1.0,10/29,7.94%,Dmd;Cldn1;Jam3;Vcl;Jam2;Gja1;Gjb6;Slc12a2;Lama2;Itgb1
prerank,Embryonic Limb Morphogenesis (GO:0030326),0.6880868936061797,1.1534041728430509,0.3250620347394541,1.0,1.0,8/31,6.64%,Cacna1c;Ski;Tgfb2;Hdac1;Ptch1;Crebbp;Nipbl;Ctnnb1
prerank,Dicarboxylic Acid Catabolic Process (GO:0043649),-0.7217530158051664,-1.1529598905944225,0.30337078651685395,1.0,1.0,5/15,9.81%,Mthfs;Glul;Aspa;Aldh1l1;Glud1
prerank,Regulation Of Macromolecule Biosynthetic Process (GO:0010556),0.6323289822032426,1.1529545636345837,0.2777777777777778,1.0,1.0,10/52,9.83%,Grm5;Cyfip1;Rb1cc1;Elp2;Elp4;Rbm3;Gcn1;Elp1;Kat7;Eif4e
prerank,Regulation Of Cytokine Production Involved In Immune Response (GO:0002718),-0.695751512945347,-1.152945324124902,0.3032258064516129,1.0,1.0,6/21,12.52%,Trpm4;Laptm5;Tril;Trim6;Btk;Wnt5a
prerank,Intracellular pH Reduction (GO:0051452),0.6828219020523959,1.1528364095427508,0.3341772151898734,1.0,1.0,3/27,2.25%,Slc4a7;Dmxl2;Atp6v1a
prerank,Monoatomic Anion Transport (GO:0006820),-0.6472281912727262,-1.1525819749555606,0.28186714542190305,1.0,1.0,15/53,11.92%,Ano4;Ano5;Slc17a6;Ttyh1;Ano10;Clic4;Clic5;Slc26a7;Lrrc8b;Lrrc8c;Fxyd1;Slc26a9;Slc34a1;Clic1;Slc17a8
prerank,Regulation Of Insulin Secretion Involved In Cellular Response To Glucose Stimulus (GO:0061178),-0.7006690205314672,-1.1523707369452256,0.3104026845637584,1.0,1.0,7/24,8.41%,Efna5;Trpm4;Epha5;Ano1;Klf7;Cftr;Adra2a
prerank,acyl-CoA Metabolic Process (GO:0006637),-0.6880071954347441,-1.1522593579693794,0.3232830820770519,1.0,1.0,6/27,13.76%,Hmgcs1;Acot9;Glyat;Acot7;Hmgcs2;Acsm3
prerank,Positive Regulation Of Release Of Sequestered Calcium Ion Into Cytosol (GO:0051281),0.6785956719862262,1.1521842944831802,0.3194103194103194,1.0,1.0,4/29,5.14%,Snca;Cemip;Capn3;Calm1
prerank,Alpha-Amino Acid Catabolic Process (GO:1901606),-0.6746670244225854,-1.1519210411936045,0.31270903010033446,1.0,1.0,1/29,0.96%,Hmgcll1
prerank,Sensory Perception (GO:0007600),-0.6582210876032943,-1.1518897317714558,0.2958257713248639,1.0,1.0,13/44,10.69%,Pcdh15;Whrn;Oprk1;P2rx7;Gnas;P2rx4;Trpv2;Kcna2;Prok2;Kcnk4;Ptges;Pnoc;Ntsr2
prerank,Chemokine-Mediated Signaling Pathway (GO:0070098),0.6852184637501608,1.151861505111655,0.3089622641509434,1.0,1.0,1/33,0.51%,Ptk2b
prerank,Positive Regulation Of Endothelial Cell Proliferation (GO:0001938),0.6148223901597419,1.1515885049232149,0.2660753880266075,1.0,1.0,10/72,3.04%,Prox1;Sema5a;Prkd1;Nell2;Cntn1;Ppp1r16b;Akt3;Tgfbr1;Cdh13;Itga4
prerank,Zinc Ion Transmembrane Transport (GO:0071577),0.7042532949917201,1.1509392771997604,0.3439153439153439,1.0,1.0,3/21,2.38%,Slc39a6;Slc39a11;Slc30a3
prerank,Positive Regulation Of Heart Contraction (GO:0045823),0.736274949199852,1.1502883348573978,0.3660287081339713,1.0,1.0,3/17,3.85%,Ryr2;Scn3b;Tgfb2
prerank,Regulation Of Neuron Death (GO:1901214),0.6417857184434675,1.1501393169963088,0.25162689804772237,1.0,1.0,8/56,3.69%,Grin2b;Snca;Chrna7;Sorl1;Nsmf;Mef2c;Trim2;Fyn
prerank,Phosphatidylinositol-Mediated Signaling (GO:0048015),-0.6323132971459329,-1.1490714183658197,0.26373626373626374,1.0,1.0,17/60,6.04%,Myo16;Nyap2;Plch2;Plcb4;Gab2;Pik3r1;Tyro3;Htr2a;Igf1;Csf1r;Nf1;Plch1;Pdgfra;Ezr;Zfp36l1;Erbb3;Pik3cd
prerank,Cellular Response To Ketone (GO:1901655),0.6666752368584676,1.14814722747533,0.3250620347394541,1.0,1.0,7/38,5.45%,Adcy1;Adcy2;Trerf1;Gng2;Scnn1a;Klf9;Src
prerank,T-helper Cell Differentiation (GO:0042093),-0.7083042164689357,-1.1479333145295563,0.30441400304414,1.0,1.0,7/16,21.62%,Lef1;Zfpm1;Foxp1;Batf;Stat4;Gpr183;Gata3
prerank,Regulation Of Extrinsic Apoptotic Signaling Pathway (GO:2001236),-0.6295515633486969,-1.1477298276110037,0.3074141048824593,1.0,1.0,12/58,11.75%,Sh3rf1;Deptor;Igf1;Tcf7l2;Cav1;Wwox;Cyld;Itga6;Tnfsf10;Bid;Bcl10;Ltb
prerank,Negative Regulation Of Protein Depolymerization (GO:1901880),-0.6916793458395099,-1.147670861587849,0.31259968102073366,1.0,1.0,2/23,1.51%,Stmn2;Nav3
prerank,Negative Regulation Of Peptidase Activity (GO:0010466),-0.6618595033930919,-1.1468997354466672,0.31825795644891125,1.0,1.0,8/44,6.20%,Spock1;Nrg1;Serpini1;Serpine2;Cst3;Timp2;Vtn;Lrp1
prerank,Immunoglobulin Mediated Immune Response (GO:0016064),-0.7086500640471545,-1.1467907093316043,0.31645569620253167,1.0,1.0,4/15,15.17%,Gnao1;Cd81;Cd74;Il21r
prerank,Regulation Of Cell Division (GO:0051302),-0.6129877116287197,-1.1467864966334083,0.2693726937269373,1.0,1.0,16/81,14.85%,Sh3glb1;Fgf1;Kif13a;Kat2b;Klhl13;Mllt3;Ccp110;Aurkb;Ncoa3;Plk3;Sfrp2;Cib1;Txnip;Sirt2;Evi2b;Insc
prerank,Monoatomic Ion Transport (GO:0006811),0.5810819881176834,1.1463619850747855,0.229957805907173,1.0,1.0,10/105,2.81%,Trpc6;Trpm3;Gabrb1;Slc24a2;Slc8a2;Chrna7;Grin1;Slc24a4;Slc17a7;Slc1a1
prerank,Negative Regulation Of Lipid Storage (GO:0010888),-0.7088482736906385,-1.1461709239632323,0.34108527131782945,1.0,1.0,7/17,19.25%,Ttc39b;Pparg;Abhd5;Osbpl8;Trem2;Nfkbia;Itgb3
prerank,Positive Regulation Of Developmental Process (GO:0051094),-0.5272852258462253,-1.1458255741885666,0.1869328493647913,1.0,1.0,28/219,5.49%,Sox5;Cobl;Alk;Reln;Elapor2;Ptn;Nrxn1;Enpp2;Sox6;Camk1;Sinhcaf;Lef1;Phldb2;Trpm4;Dlx1;Lcp1;Bmpr1b;Apoe;Smarcd3;Dcn;Rapgef3;Dab2ip;Gja1;Bcl7c;Phldb1;Foxd1;Bmp7;Pparg
prerank,Regulation Of Dendritic Spine Morphogenesis (GO:0061001),0.6709575406680108,1.1454747126886278,0.32160804020100503,1.0,1.0,7/29,2.94%,Ppfia2;Epha4;Camk2b;Sipa1l1;Nlgn1;Dbn1;Lzts3
prerank,Positive Regulation Of Rho Protein Signal Transduction (GO:0035025),-0.679926530156844,-1.1447590368837741,0.3020833333333333,1.0,1.0,8/29,11.42%,Prag1;Robo1;Lpar1;Akap13;Adgrg1;Col3a1;F11r;Gpr17
prerank,Long-Chain fatty-acyl-CoA Biosynthetic Process (GO:0035338),-0.7154493798892448,-1.143561194034167,0.3270735524256651,1.0,1.0,4/17,6.05%,Elovl6;Hsd17b12;Elovl7;Acsl3
prerank,Monoatomic Anion Transmembrane Transport (GO:0098656),0.6434635430268905,1.143522151370249,0.2921615201900237,1.0,1.0,12/52,3.62%,Gabrb3;Ano3;Gabra2;Gabrb1;Gabrb2;Gabra4;Gabrg2;Gabra5;Ano2;Slc1a1;Glra2;Ano6
prerank,Negative Regulation Of Transforming Growth Factor Beta Receptor Signaling Pathway (GO:0030512),-0.6088161318170571,-1.143390683376429,0.2719449225473322,1.0,1.0,11/74,6.67%,Sinhcaf;Ltbp1;Smurf1;Spred3;Tgfb1i1;Cav1;Pparg;Cd109;Spred1;Smad7;Smad6
prerank,Glycolipid Biosynthetic Process (GO:0009247),-0.6662882262830214,-1.1433719957955208,0.32521739130434785,1.0,1.0,5/40,4.92%,St8sia5;St3gal6;Cwh43;St8sia6;Sccpdh
prerank,Anterograde Axonal Transport (GO:0008089),0.6636739490832334,1.1432092368140652,0.3054892601431981,1.0,1.0,7/38,7.93%,Dlg2;Trim46;Kif1c;Kif5c;Nefl;Kif5b;Bloc1s5
prerank,Epithelial Cell Migration (GO:0010631),-0.6537047523209686,-1.1428373231960745,0.2975352112676056,1.0,1.0,11/41,8.59%,Nell1;Kit;Plxnd1;Daam2;Kank1;Dpp4;Fermt1;Anln;S100a2;Fat2;Loxl2
prerank,Positive Regulation Of Calcium Ion Transmembrane Transporter Activity (GO:1901021),0.6942220782612648,1.1419790086599195,0.3772609819121447,1.0,1.0,5/27,3.52%,Ppp3ca;Ryr2;Ank2;Ppp3r1;Atp1b1
prerank,Osteoclast Differentiation (GO:0030316),-0.69712356016758,-1.141769679579756,0.3202511773940345,1.0,1.0,3/25,2.95%,Gab2;Csf1r;Tnfrsf11a
prerank,"Positive Regulation Of mRNA Splicing, Via Spliceosome (GO:0048026)",0.7314446547456039,1.14168680911908,0.36341463414634145,1.0,1.0,7/18,10.67%,Celf4;Clns1a;Ncbp1;Rbm3;Ncl;Tra2b;Rbmx
prerank,Negative Regulation Of Cell Communication (GO:0010648),-0.7106436980651745,-1.141456068978512,0.3241935483870968,1.0,1.0,8/21,14.63%,Inpp5d;Kif26a;Erbb3;Fgf23;Hhip;Ptpn1;Il11;Oprm1
prerank,Positive Regulation Of Nervous System Development (GO:0051962),0.646703759695955,1.1414408636556983,0.30927835051546393,1.0,1.0,9/45,4.26%,Il1rap;Clstn2;Il1rapl1;Nlgn1;Slitrk2;Slitrk3;Ptprd;Nlgn3;Faim
prerank,Regulation Of Phosphorylation (GO:0042325),-0.6074749479935933,-1.1407875549845143,0.2730627306273063,1.0,1.0,8/79,3.36%,Nell1;Ldb2;Fn1;Ccdc88c;Igf1;Fer;Cadm4;App
prerank,Vesicle Transport Along Actin Filament (GO:0030050),-0.6871909171917243,-1.1407061530736835,0.32576985413290116,1.0,1.0,5/18,6.10%,Fnbp1l;Myo1e;Myo6;Myo5c;Myo1c
